Bình Thuận,Bo Ke Lucky,https://www.tripadvisor.com/Restaurant_Review-g298086-d4539239-Reviews-Bo_Ke_Lucky-Phan_Thiet_Binh_Thuan_Province.html,"126 Nguyen Dinh Chieu Ham Tien, Phan Thiet, Phan Thiet Vietnam",nan,nan,nan,#93 of 361 Restaurants in Phan Thiet,nan,4.0,nan,nan,nan,nan,46 reviews,nan,nan,nan,nan,"Lunch, Dinner",nan,"Seating, Serves Alcohol",https://dynamic-media-cdn.tripadvisor.com/media/photo-o/06/06/1c/70/caption.jpg?w=900&h=500&s=1
Bình Thuận,Bo Ke Hoang Hon Seafood Resturant,https://www.tripadvisor.com/Restaurant_Review-g298086-d5264144-Reviews-Bo_Ke_Hoang_Hon_Seafood_Resturant-Phan_Thiet_Binh_Thuan_Province.html,"Nhat Thi Guesthouse 155 Nguyen Dinh Chieu, Phan Thiet Vietnam",nan,+84 97 422 17 68,nan,#78 of 361 Restaurants in Phan Thiet,nan,4.0,4.6,4.2,4.6,3.2,63 reviews,nan,nan,nan,nan,Dinner,nan,"Takeout, Seating, Wheelchair Accessible",https://dynamic-media-cdn.tripadvisor.com/media/photo-o/0d/ab/63/c9/img-20161119-194548-largejpg.jpg?w=900&h=500&s=1
Bình Thuận,Thuy Anh,https://www.tripadvisor.com/Restaurant_Review-g1009804-d12130746-Reviews-Thuy_Anh-Mui_Ne_Phan_Thiet_Binh_Thuan_Province.html,"Highway 706, Mui Ne, Phan Thiet Vietnam",nan,+84 90 838 98 36,nan,#69 of 84 Restaurants in Mui Ne,nan,3.0,nan,nan,nan,nan,14 reviews,nan,nan,nan,nan,nan,nan,Table Service,https://dynamic-media-cdn.tripadvisor.com/media/photo-o/12/bc/79/d6/makaron-z-wolowina.jpg?w=800&h=500&s=1
Bình Thuận,Seahorse Restaurant,https://www.tripadvisor.com/Restaurant_Review-g298086-d2101599-Reviews-Seahorse_Restaurant-Phan_Thiet_Binh_Thuan_Province.html,"01 Ton Duc Thang Ham Tien, Phan Thiet, Phan Thiet Vietnam",nan,nan,om@phanthietresorts.com,#164 of 361 Restaurants in Phan Thiet,nan,3.5,3.0,3.2,2.7,nan,28 reviews,"This restaurant is located in the Novotel Phan Thiet Ocean Dunes & Golf Resort. The restaurant is also open for general public, not only guests of the resort. For more questions, please contact me.",nan,nan,nan,Dinner,nan,Seating,https://dynamic-media-cdn.tripadvisor.com/media/photo-o/01/db/7e/0e/seahorse-restaurant.jpg?w=900&h=500&s=1
Bình Thuận,Sukhumvit Thai Street Food & Beer,https://www.tripadvisor.com/Restaurant_Review-g1009804-d25613570-Reviews-Sukhumvit_Thai_Street_Food_Beer-Mui_Ne_Phan_Thiet_Binh_Thuan_Province.html,"8A Hồ Quang Cảnh, khu phố 3, Thành phố Phan Thiết, Mui Ne, Phan Thiet Vietnam",https://www.facebook.com/sukhumvit.vn,+84 395 110 934,sukhumvit.vietnam@gmail.com,#61 of 84 Restaurants in Mui Ne,"Sun: 5:00 PM - 10:00 PM, Mon: 5:00 PM - 10:00 PM, Tue: 5:00 PM - 10:00 PM, Wed: 5:00 PM - 10:00 PM, Thu: 5:00 PM - 10:00 PM, Fri: 5:00 PM - 10:00 PM, Sat: 5:00 PM - 10:00 PM",5.0,nan,nan,nan,nan,1 review,Món ăn đường phố Thái Lan đích thực & Bia. Authentic Thai Street Food & Beer.,nan,nan,nan,"Lunch, Dinner, Drinks",nan,"Delivery, Takeout, Outdoor Seating, Seating, Street Parking, Wheelchair Accessible, Serves Alcohol, Wine and Beer, Accepts American Express, Accepts Mastercard, Accepts Visa, Digital Payments, Cash Only, Free Wifi, Accepts Credit Cards",https://dynamic-media-cdn.tripadvisor.com/media/photo-o/2a/21/33/31/caption.jpg?w=900&h=500&s=1
Bình Thuận,Manh Thom,https://www.tripadvisor.com/Restaurant_Review-g298086-d25451513-Reviews-Manh_Thom-Phan_Thiet_Binh_Thuan_Province.html,"Phu Hai Nähe des Hotels Phu Hai Resort, Phan Thiet Vietnam",nan,+84 91 771 75 59,nan,#91 of 361 Restaurants in Phan Thiet,Mon: 12:00 AM - 11:59 PM,5.0,nan,nan,nan,nan,7 reviews,nan,nan,nan,nan,"Breakfast, Lunch, Dinner, Drinks",nan,Reservations,https://dynamic-media-cdn.tripadvisor.com/media/photo-o/29/4c/a8/73/caption.jpg?w=900&h=500&s=1
Bình Thuận,Restaurant ViVu Food,https://www.tripadvisor.com/Restaurant_Review-g298086-d18928150-Reviews-Restaurant_ViVu_Food-Phan_Thiet_Binh_Thuan_Province.html,"45C Huynh Thuc Khang Ham Tien Ward, Phan Thiet 800000 Vietnam",http://vivufood.vn,+84 97 333 30 09,vivufood.vn@gmail.com,#115 of 361 Restaurants in Phan Thiet,"Sun: 10:00 AM - 10:00 PM, Mon: 10:00 AM - 10:00 PM, Tue: 10:00 AM - 10:00 PM, Wed: 10:00 AM - 10:00 PM, Thu: 10:00 AM - 10:00 PM, Fri: 10:00 AM - 10:00 PM, Sat: 10:00 AM - 10:00 PM",5.0,5.0,5.0,4.4,nan,6 reviews,"Vivu Food Restaurant is a delicious restaurant in Ham Tien Mui Ne. Many tourists come here. Because of Good food, Happy service and very cheap price. Very pleased to welcome you. Nhà Hàng Cơm Niêu ViVu Food là quán ăn ngon Mũi Né - Phan Thiết - Bình Thuận. Được đánh giá là quán cơm niêu ngon tại Mũi Né. Nấu ăn ngon và giá cả hợp lý. Bán hàng bằng cái tâm không chặt chém, không tăng giá.",1.0,6.0,nan,"Lunch, Dinner, Brunch, Drinks",nan,"Buffet, Free off-street parking, Serves Alcohol, Jazz Bar, Dog Friendly, Family style, Sports bars",https://dynamic-media-cdn.tripadvisor.com/media/photo-o/19/3f/42/01/restaurant-vivu-food.jpg?w=900&h=-1&s=1
Bình Thuận,Rainbow Restaurant,https://www.tripadvisor.com/Restaurant_Review-g1009804-d9710162-Reviews-Rainbow_Restaurant-Mui_Ne_Phan_Thiet_Binh_Thuan_Province.html,"Nguyen Dinh Chieu, 43, Mui Ne, Phan Thiet Vietnam",nan,+84 62 3741 240,nan,#42 of 84 Restaurants in Mui Ne,nan,4.0,nan,nan,nan,nan,15 reviews,nan,nan,nan,nan,nan,nan,nan,https://dynamic-media-cdn.tripadvisor.com/media/photo-o/10/5c/d4/e5/photo0jpg.jpg?w=900&h=500&s=1
Bình Thuận,Thao Nhu Restaurant,https://www.tripadvisor.com/Restaurant_Review-g1009804-d12480979-Reviews-Thao_Nhu_Restaurant-Mui_Ne_Phan_Thiet_Binh_Thuan_Province.html,"77 Huynh Thuc Khang Street, Quarter 4, Ham Tien Ward, Mui Ne, Phan Thiet Vietnam",nan,+84 90 240 05 94,nan,#53 of 84 Restaurants in Mui Ne,nan,4.0,nan,nan,nan,nan,7 reviews,nan,nan,nan,nan,nan,nan,Reservations,https://dynamic-media-cdn.tripadvisor.com/media/photo-o/0f/74/04/30/perch-fish.jpg?w=900&h=500&s=1
Bình Thuận,Phố Ẩm Thực Hương Biển,https://www.tripadvisor.com/Restaurant_Review-g298086-d25184760-Reviews-Ph_m_Th_c_Huong_Bi_n-Phan_Thiet_Binh_Thuan_Province.html,"A63 Đại Lộ Hùng Vương, Phường Phú Thủy Hung Vuong Residential Area, Phan Thiet 800000 Vietnam",https://phoamthuchuongbien.com/,+84 797 568 686,phoamthuchuongbien@gmail.com,#176 of 361 Restaurants in Phan Thiet,"Sun: 8:00 AM - 11:00 PM, Mon: 8:00 AM - 11:00 PM, Tue: 8:00 AM - 11:00 PM, Wed: 8:00 AM - 11:00 PM, Thu: 8:00 AM - 11:00 PM, Fri: 8:00 AM - 11:00 PM, Sat: 8:00 AM - 11:00 PM",4.5,nan,nan,nan,nan,2 reviews,"Phố Ẩm Thực Hương Biển là nhà hàng sở hữu một không gian ẩm thực mát mẻ, gần gũi với thiên nhiên với sự kết hợp tinh tế giữa văn hóa ẩm thực Việt Nam và các nền văn hóa ẩm thực Á Đông. Đến với Phố Ẩm Thực Hương Biển, khách hàng có thể thưởng thức những món ăn độc đáo, sáng tạo và mang đậm dấu ấn đặc trưng. Trong đó, ấn tượng và nổi bật nhất với thiết kể ẩm thực chủ đạo gồm những món ăn đặc sắc chế biến từ nguyên liệu truyền thống và các nguyên liệu hải sản tươi ngon tại Phan Thiết. Ngoài ra Phố Ẩm Thực Hương Biển còn phục vụ cơm niêu, cơm văn phòng, cơm khách đoàn Tour khi ghé chân đến Phan Thiết.",0.0,80.0,nan,"Lunch, Dinner, Brunch",nan,"Delivery, Reservations, Seating, Parking Available, Free off-street parking, Television, Wine and Beer, Accepts American Express, Accepts Mastercard, Accepts Visa, Free Wifi, Accepts Discover, Accepts Credit Cards, Table Service, Waterfront, Dog Friendly, Family style",https://dynamic-media-cdn.tripadvisor.com/media/photo-o/29/83/39/66/ph-m-th-c-huong-bi-n.jpg?w=800&h=500&s=1
Bình Thuận,Cat Tuong,https://www.tripadvisor.com/Restaurant_Review-g298086-d4793200-Reviews-Cat_Tuong-Phan_Thiet_Binh_Thuan_Province.html,"69 Nguyen Dinh Chieu Ham Tien, Phan Thiet, Phan Thiet 74000 Vietnam",nan,+84 90 992 18 98,nan,#159 of 361 Restaurants in Phan Thiet,nan,3.5,3.6,3.6,3.8,3.5,61 reviews,nan,nan,nan,nan,"Lunch, Dinner",Vegetarian friendly,"Takeout, Reservations, Seating, Serves Alcohol, Table Service",https://dynamic-media-cdn.tripadvisor.com/media/photo-o/0a/60/ee/72/20160220-104207-largejpg.jpg?w=900&h=-1&s=1
Bình Thuận,1985cafe,https://www.tripadvisor.com/Restaurant_Review-g298086-d11886996-Reviews-1985cafe-Phan_Thiet_Binh_Thuan_Province.html,"08 Hoang Hoa Tham Phu Thuy Ward, Phan Thiet Vietnam",nan,+84 91 952 66 39,1985co.garden@gmail.com,#124 of 361 Restaurants in Phan Thiet,"Sun: 6:00 AM - 10:00 PM, Mon: 6:00 AM - 10:00 PM, Tue: 6:00 AM - 10:00 PM, Wed: 6:00 AM - 10:00 PM, Thu: 6:00 AM - 10:00 PM, Fri: 6:00 AM - 10:00 PM, Sat: 6:00 AM - 10:00 PM",5.0,nan,nan,nan,nan,8 reviews,nan,nan,nan,nan,Drinks,nan,"Reservations, Outdoor Seating, Parking Available, Street Parking, Validated Parking, Valet Parking, Free Wifi",https://dynamic-media-cdn.tripadvisor.com/media/photo-o/0e/67/cb/9b/from-the-outside.jpg?w=900&h=500&s=1
Bình Thuận,Hai Bang Restaurant,https://www.tripadvisor.com/Restaurant_Review-g13172842-d16951895-Reviews-Hai_Bang_Restaurant-Ham_Tien_Phan_Thiet_Binh_Thuan_Province.html,"61A Huynh Thuc Khang, Ham Tien, Phan Thiet Vietnam",nan,+84 90 606 53 26,nan,#27 of 67 Restaurants in Ham Tien,nan,5.0,nan,nan,nan,nan,5 reviews,nan,nan,nan,nan,nan,nan,nan,https://dynamic-media-cdn.tripadvisor.com/media/photo-o/17/04/d2/43/2019.jpg?w=900&h=500&s=1
Bình Thuận,Joya Kitchen,https://www.tripadvisor.com/Restaurant_Review-g298086-d28196015-Reviews-Joya_Kitchen-Phan_Thiet_Binh_Thuan_Province.html,"246 Nguyễn Đình Chiểu, Phường Hàm Tiến., Phan Thiet Vietnam",nan,+84378523905,viethunglai94@gmail.com,#147 of 361 Restaurants in Phan Thiet,nan,5.0,nan,nan,nan,nan,2 reviews,nan,nan,nan,nan,"Lunch, Dinner, Brunch",nan,"Takeout, Reservations, Buffet, Seating, Parking Available, Valet Parking, Free off-street parking, Serves Alcohol, Full Bar, Wine and Beer, Accepts American Express, Accepts Mastercard, Accepts Visa, Digital Payments, Free Wifi, Accepts Discover, Table Service, Dog Friendly, Family style",https://dynamic-media-cdn.tripadvisor.com/media/photo-o/2d/6f/10/5d/mexican-food.jpg?w=900&h=500&s=1
Bình Thuận,Tulip Muine Restaurant,https://www.tripadvisor.com/Restaurant_Review-g13172842-d16817222-Reviews-Tulip_Muine_Restaurant-Ham_Tien_Phan_Thiet_Binh_Thuan_Province.html,"106 Nguyen Dinh Chieu, Ham Tien, Phan Thiet 800000 Vietnam",https://www.facebook.com/Tulip-muine-restaurant-2182061731823284/,+84 91 952 55 43,nan,#22 of 67 Restaurants in Ham Tien,nan,4.5,nan,nan,nan,nan,16 reviews,nan,nan,nan,nan,nan,nan,Reservations,https://dynamic-media-cdn.tripadvisor.com/media/photo-o/18/3f/ae/21/welcome-get-trying-pork.jpg?w=900&h=500&s=1
Bình Thuận,33 Burger,https://www.tripadvisor.com/Restaurant_Review-g298086-d15122760-Reviews-33_Burger-Phan_Thiet_Binh_Thuan_Province.html,"33 Huynh Thuc Khang, Phan Thiet 800000 Vietnam",https://www.facebook.com/tinh.burger/,+84 91 734 90 19,nan,#101 of 361 Restaurants in Phan Thiet,"Sun: 12:00 AM - 11:59 PM, Mon: 7:00 AM - 11:00 PM, Tue: 7:00 AM - 11:00 PM, Wed: 7:00 AM - 11:00 PM, Thu: 7:00 AM - 11:00 PM, Fri: 12:00 AM - 11:59 PM, Sat: 12:00 AM - 11:59 PM",5.0,nan,nan,nan,nan,11 reviews,"The name of my restaurant is 33 Burger and it’s situated in the centre place of the city. The restaurant offers several dishes including burger, sandwich, pizza, pancake, ice-creams... The prices are reasonable and the foods are served quickly",1.0,6.0,nan,"Breakfast, Lunch, Dinner, Brunch, Late Night, Drinks",nan,"Delivery, Takeout, Parking Available, Wine and Beer, Free Wifi, Table Service",https://dynamic-media-cdn.tripadvisor.com/media/photo-o/19/16/42/76/hamburger.jpg?w=900&h=500&s=1
Bình Thuận,Hong Vinh 1,https://www.tripadvisor.com/Restaurant_Review-g298086-d6353259-Reviews-Hong_Vinh_1-Phan_Thiet_Binh_Thuan_Province.html,"126 Nguyen Dinh Chieu Ham Tien wd, Phan Thiet 0623 Vietnam",nan,09888872572,nan,#179 of 361 Restaurants in Phan Thiet,Fri: 8:00 AM - 10:00 PM,4.0,nan,nan,nan,nan,7 reviews,nan,nan,nan,nan,"Breakfast, Lunch, Dinner",nan,nan,https://dynamic-media-cdn.tripadvisor.com/media/photo-o/0a/ea/96/28/photo1jpg.jpg?w=900&h=500&s=1
Bình Thuận,Xet. Pasta,https://www.tripadvisor.com/Restaurant_Review-g298086-d27743960-Reviews-Xet_Pasta-Phan_Thiet_Binh_Thuan_Province.html,"228 Tôn Đức Thắng, Phú Thuỷ, Phan Thiet Vietnam",https://www.facebook.com/xet.miyphomai/,+84 93 773 14 94,xetmiyphomai@gmail.com,#187 of 361 Restaurants in Phan Thiet,"Sun: 7:00 AM - 10:00 PM, Mon: 6:00 AM - 9:30 PM, Tue: 6:00 AM - 9:30 PM, Wed: 6:00 AM - 9:30 PM, Thu: 6:00 AM - 9:30 PM, Fri: 6:00 AM - 9:30 PM, Sat: 7:00 AM - 10:00 PM",nan,nan,nan,nan,nan,nan,"XET.Pasta – The Heart of Fusion Flavors in Phan Thiet Located in the bustling center of Phan Thiet, XET.Pasta is a one-of-a-kind dining spot dedicated to serving special pasta dishes with a unique twist. With a passion for blending traditional Italian pasta with Vietnamese flair, XET.Pasta offers a diverse menu that caters to all tastes, from classic spaghetti to exclusive fusion creations that capture the essence of local flavors. Whether you’re a pasta enthusiast or simply seeking a fresh and exciting dining experience, XET.Pasta promises a journey of flavors in every bite. Perfect for family outings, friendly gatherings, or a cozy date, XET.Pasta is where great taste meets vibrant culture.",0.0,40.0,nan,"Breakfast, Lunch, Dinner, Brunch",nan,"Delivery, Takeout, Reservations, Seating, Parking Available, Free off-street parking, Digital Payments, Free Wifi, Jazz Bar",https://dynamic-media-cdn.tripadvisor.com/media/photo-o/2c/30/e7/c7/our-brand.jpg?w=900&h=500&s=1
Bình Thuận,Vegan Vy Dieu,https://www.tripadvisor.com/Restaurant_Review-g1009804-d12847417-Reviews-Vegan_Vy_Dieu-Mui_Ne_Phan_Thiet_Binh_Thuan_Province.html,"15B Huynh Thuc Khang, Mui Ne, Phan Thiet Vietnam",nan,+84 90 922 12 85,nan,#38 of 84 Restaurants in Mui Ne,nan,5.0,nan,nan,nan,nan,9 reviews,nan,nan,nan,nan,nan,nan,Reservations,https://dynamic-media-cdn.tripadvisor.com/media/photo-o/17/5f/0a/61/20190430-080534-largejpg.jpg?w=600&h=400&s=1
Bình Thuận,BỜM Cơm Niêu Hải Sản - BOM Restaurant,https://www.tripadvisor.com/Restaurant_Review-g298086-d26862462-Reviews-B_M_Com_Nieu_H_i_S_n_BOM_Restaurant-Phan_Thiet_Binh_Thuan_Province.html,"77 Nguyễn Đình Chiểu, Phan Thiet Vietnam",nan,+84 378 841 836,dtngocthoa95@gmail.com,#155 of 361 Restaurants in Phan Thiet,"Sun: 7:00 AM - 11:00 PM, Mon: 7:00 AM - 11:00 PM, Tue: 7:00 AM - 11:00 PM, Wed: 7:00 AM - 11:00 PM, Thu: 7:00 AM - 11:00 PM, Fri: 7:00 AM - 11:00 PM, Sat: 7:00 AM - 11:00 PM",5.0,nan,nan,nan,nan,2 reviews,"Hải sản tươi sống Cơm niêu Cơm đoàn Cơm gia đình Các món Âu, Á",nan,nan,nan,"Breakfast, Lunch, Dinner, Brunch, Late Night, Drinks",nan,nan,https://dynamic-media-cdn.tripadvisor.com/media/photo-o/2b/66/35/30/caption.jpg?w=900&h=500&s=1
Bình Thuận,Opla!,https://www.tripadvisor.com/Restaurant_Review-g298086-d26701470-Reviews-Opla-Phan_Thiet_Binh_Thuan_Province.html,"143 Nguyen Dinh Chieu, Phan Thiet Vietnam",https://www.facebook.com/opla.muine,+84 88 632 24 33,nan,#131 of 361 Restaurants in Phan Thiet,"Sun: 8:00 AM - 7:00 PM, Mon: 8:00 AM - 7:00 PM, Tue: 8:00 AM - 7:00 PM, Thu: 8:00 AM - 7:00 PM, Fri: 8:00 AM - 7:00 PM, Sat: 8:00 AM - 7:00 PM",5.0,nan,nan,nan,nan,3 reviews,"! is a take on the Vietnamese word ""ốp la"" which means sunny-side-up. We serve all day brunch & lunch dishes inspired by flavors from around the world. Enjoy our international menu of comfort food that reflects our love for quality ingredients in a casual setting. To compliment your meal we also offer cold-pressed juices, specialty coffee, craft beer & sake. Join us in Mũi Né for a memorable experience.",3.0,7.0,nan,"Breakfast, Lunch, Dinner, Brunch, Drinks",nan,"Outdoor Seating, Seating, Street Parking, Serves Alcohol, Accepts Mastercard, Accepts Visa, Digital Payments, Free Wifi, Accepts Credit Cards, Table Service, Family style",https://dynamic-media-cdn.tripadvisor.com/media/photo-o/2a/a7/31/82/a-restaurant-with-a-nice.jpg?w=900&h=500&s=1
Bình Thuận,Dragonfly,https://www.tripadvisor.com/Restaurant_Review-g298086-d1977418-Reviews-Dragonfly-Phan_Thiet_Binh_Thuan_Province.html,"Main/commercial road along Mui Ne beach, Phan Thiet Vietnam",http://www.muinebeach.net/dragonfly/,+84 91 728 02 90,dragonflymuine@yahoo.com,#133 of 361 Restaurants in Phan Thiet,nan,3.5,3.7,3.2,3.8,3.1,24 reviews,nan,nan,nan,nan,Dinner,nan,"Reservations, Seating, Table Service",https://dynamic-media-cdn.tripadvisor.com/media/photo-o/0a/5a/b6/7d/photo1jpg.jpg?w=900&h=500&s=1
Bình Thuận,Razgulay,https://www.tripadvisor.com/Restaurant_Review-g298086-d5617422-Reviews-Razgulay-Phan_Thiet_Binh_Thuan_Province.html,"187 Nguyen Dinh Chien, Phan Thiet Vietnam",http://restaurant-razgulay.com,+84 120 765 0014,sergey-fed2@yandex.ru,#212 of 361 Restaurants in Phan Thiet,nan,4.5,nan,nan,nan,nan,4 reviews,nan,nan,nan,nan,nan,nan,nan,https://dynamic-media-cdn.tripadvisor.com/media/photo-o/05/1e/84/7a/razgulay.jpg?w=900&h=500&s=1
Bình Thuận,Areka,https://www.tripadvisor.com/Restaurant_Review-g298086-d2457881-Reviews-Areka-Phan_Thiet_Binh_Thuan_Province.html,"Opposite Lucy Resort Huynh Thuc Khang Street, Phan Thiet Vietnam",nan,nan,nan,#122 of 361 Restaurants in Phan Thiet,nan,4.0,4.2,3.8,4.6,3.4,40 reviews,Opposite the Lucy Resort,nan,nan,nan,"Lunch, Dinner",nan,Table Service,https://dynamic-media-cdn.tripadvisor.com/media/photo-o/1a/d4/fa/a5/caption.jpg?w=400&h=300&s=1
Bình Thuận,Green Queen Cafe,https://www.tripadvisor.com/Restaurant_Review-g13172842-d15764298-Reviews-Green_Queen_Cafe-Ham_Tien_Phan_Thiet_Binh_Thuan_Province.html,"H93 Nguyen Dinh Chieu On the Jamp arena territory, Ham Tien, Phan Thiet 800000 Vietnam",https://www.facebook.com/GreenQueenMuine/,+84764905201,nan,#16 of 67 Restaurants in Ham Tien,"Sun: 9:00 AM - 8:00 PM, Mon: 9:00 AM - 8:00 PM, Tue: 9:00 AM - 8:00 PM, Wed: 9:00 AM - 8:00 PM, Thu: 9:00 AM - 8:00 PM, Fri: 9:00 AM - 8:00 PM, Sat: 9:00 AM - 8:00 PM",4.5,5.0,5.0,4.6,nan,19 reviews,"Bast autors cuisine in MuiNe. Chef from St. Petersburg. Work experience 30 years. Warm salads, best smoothie bowls. Very tasty and not usual . Surprise yourself and your friends.",1.0,5.0,nan,"Breakfast, Lunch, Dinner","Vegetarian friendly, Vegan options","Takeout, Seating, Table Service",https://dynamic-media-cdn.tripadvisor.com/media/photo-o/1a/01/24/a1/caption.jpg?w=900&h=500&s=1
Bình Thuận,Momo Cafe Restaurant,https://www.tripadvisor.com/Restaurant_Review-g13172842-d17423578-Reviews-Momo_Cafe_Restaurant-Ham_Tien_Phan_Thiet_Binh_Thuan_Province.html,"177 Nguyen Dinh Chieu, Ham Tien, Phan Thiet 800000 Vietnam",http://www.facebook.com/MoMo-cafe-restaurant-413092122580287/?modal=admin_todo_tour,+84 252 3748 177,roxyngoc@gmail.com,#30 of 67 Restaurants in Ham Tien,"Sun: 7:00 AM - 10:00 PM, Tue: 7:00 AM - 10:00 PM, Wed: 7:00 AM - 10:00 PM, Thu: 7:00 AM - 10:00 PM, Fri: 7:00 AM - 10:00 PM, Sat: 7:00 AM - 10:00 PM",4.0,nan,nan,nan,nan,19 reviews,"We have Italian coffee and serve breakfast from 7am Fresh sushi and sashimi Many Japanese noodles udon carry is the best Japanese restaurant in Mui Ne, we are committed to quality as honor",0.0,8.0,nan,"Breakfast, Lunch, Dinner",nan,Reservations,https://dynamic-media-cdn.tripadvisor.com/media/photo-o/17/8b/12/1b/img-20190502-183336-largejpg.jpg?w=900&h=500&s=1
Bình Thuận,Cơm Niêu Hải Sản Việt Xưa Phan Thiết,https://www.tripadvisor.com/Restaurant_Review-g298086-d27788487-Reviews-Com_Nieu_H_i_S_n_Vi_t_Xua_Phan_Thi_t-Phan_Thiet_Binh_Thuan_Province.html,"146 Nguyễn Đình Chiểu Phường Hàm Tiến, Phan Thiet Vietnam",nan,+840779016016,gotuansykontum@gmail.com,#189 of 361 Restaurants in Phan Thiet,"Sun: 10:00 AM - 10:30 PM, Mon: 10:00 AM - 10:30 PM, Tue: 10:00 AM - 10:30 PM, Wed: 10:00 AM - 10:30 PM, Thu: 10:00 AM - 10:30 PM, Fri: 10:00 AM - 10:30 PM, Sat: 10:00 AM - 10:30 PM",5.0,nan,nan,nan,nan,1 review,nan,nan,nan,nan,"Lunch, Dinner",nan,nan,https://dynamic-media-cdn.tripadvisor.com/media/photo-o/2c/89/00/35/caption.jpg?w=900&h=500&s=1
Bình Thuận,Green Organic Villas,https://www.tripadvisor.com/Restaurant_Review-g298086-d5062765-Reviews-Green_Organic_Villas-Phan_Thiet_Binh_Thuan_Province.html,"Thon Tien Phu, Xa Tien Thanh, Phan Thiet 62000 Vietnam",http://www.greenorganicvillas.com,+84 91 746 70 68,nan,#157 of 361 Restaurants in Phan Thiet,"Sun: 8:00 AM - 10:00 PM, Mon: 8:00 AM - 10:00 PM, Tue: 8:00 AM - 10:00 PM, Wed: 8:00 AM - 10:00 PM, Thu: 8:00 AM - 10:00 PM, Fri: 8:00 AM - 10:00 PM, Sat: 8:00 AM - 10:00 PM",4.0,nan,nan,nan,nan,12 reviews,nan,nan,nan,nan,"Breakfast, Lunch, Dinner",nan,"Seating, Table Service",https://dynamic-media-cdn.tripadvisor.com/media/photo-o/05/e6/b2/d9/green-organic-villas.jpg?w=900&h=500&s=1
Bình Thuận,Hải Sản Hồng Hào Mũi Né 888,https://www.tripadvisor.com/Restaurant_Review-g298086-d25354513-Reviews-H_i_S_n_H_ng_Hao_Mui_Ne_888-Phan_Thiet_Binh_Thuan_Province.html,"187 Nguyễn Đình Chiểu, Phan Thiet Vietnam",nan,+84 94 988 48 32,duongnhungoc2022mn@gmail.com,#121 of 361 Restaurants in Phan Thiet,"Sun: 12:00 AM - 11:59 PM, Mon: 12:00 AM - 11:59 PM, Tue: 12:00 AM - 11:59 PM, Wed: 12:00 AM - 11:59 PM, Thu: 12:00 AM - 11:59 PM, Fri: 12:00 AM - 11:59 PM, Sat: 12:00 AM - 11:59 PM",5.0,nan,nan,nan,nan,4 reviews,nan,nan,nan,nan,"Breakfast, Lunch, Dinner, Brunch, Late Night, Drinks",nan,nan,https://dynamic-media-cdn.tripadvisor.com/media/photo-o/28/9c/17/7f/caption.jpg?w=900&h=500&s=1
Bình Thuận,Geneva Restaurant,https://www.tripadvisor.com/Restaurant_Review-g298086-d9714999-Reviews-Geneva_Restaurant-Phan_Thiet_Binh_Thuan_Province.html,"Km 8 - Nguyen Dinh Chieu Street - Hamlet 5 - Phu Hai Ward, Phan Thiet Vietnam",http://www.phuhairesort.com/Restaurant,+84 62 3812 799,nan,#158 of 361 Restaurants in Phan Thiet,nan,5.0,nan,nan,nan,nan,4 reviews,nan,nan,nan,nan,nan,nan,nan,https://dynamic-media-cdn.tripadvisor.com/media/photo-o/1a/67/e3/db/geneva-restaurant.jpg?w=900&h=500&s=1
Bình Thuận,"Khi Khi Grill, American BBQ Mui Ne",https://www.tripadvisor.com/Restaurant_Review-g13172842-d20240004-Reviews-Khi_Khi_Grill_American_BBQ_Mui_Ne-Ham_Tien_Phan_Thiet_Binh_Thuan_Province.html,"246 Nguyen Dinh Chieu Dong Vui Food Court, Ham Tien, Phan Thiet 901095 Vietnam",https://www.facebook.com/Mui-Ne-Khi-Khi-Grill-Home-of-the-Monkey-Sauce-100362631534829,+84 8 6280 2644,khi.khi.grill@gmail.com,#28 of 67 Restaurants in Ham Tien,"Sun: 12:00 PM - 10:30 PM, Mon: 12:00 PM - 10:30 PM, Tue: 12:00 PM - 10:30 PM, Wed: 12:00 PM - 10:30 PM, Thu: 12:00 PM - 10:30 PM, Fri: 12:00 PM - 10:30 PM, Sat: 12:00 PM - 10:30 PM",5.0,nan,nan,nan,nan,5 reviews,"Deep South BBQ USA Southern side dishes. Vietnamese inspired smoked seafood. Grilled meats. Serving pork, chicken, salmon, lamb and other special dishes like squid stuffed with smoked pork, smoked stuffed bell peppers, smoked pork belly, smoked bacon wrapped shrimp.",nan,nan,nan,"Lunch, Dinner",nan,"Delivery, Takeout, Outdoor Seating, Seating, Free off-street parking, Wheelchair Accessible, Cash Only, Free Wifi",https://dynamic-media-cdn.tripadvisor.com/media/photo-o/1b/22/af/d9/smoked-salmon-salad-mango.jpg?w=900&h=500&s=1
Bình Thuận,Hot Thai,https://www.tripadvisor.com/Restaurant_Review-g298086-d24142902-Reviews-Hot_Thai-Phan_Thiet_Binh_Thuan_Province.html,"Dong Vui, 246 Nguyen Dinh Chieu, Phan Thiet 801095 Vietnam",http://www.dongvuifoodcourt.com/hot-thai,+84 93 310 16 44,nan,#160 of 361 Restaurants in Phan Thiet,nan,5.0,nan,nan,nan,nan,2 reviews,This business is now the subject of legal action due to breach of contract. The IPR of this page is the property of the TripAdvisor account holder.,nan,nan,nan,Dinner,nan,"Takeout, Seating, Full Bar, Wine and Beer, Cash Only, Free Wifi, Family style",https://dynamic-media-cdn.tripadvisor.com/media/photo-o/24/4d/0e/12/green-curry-ca-ri-thai.jpg?w=900&h=500&s=1
Bình Thuận,Quan Lau De,https://www.tripadvisor.com/Restaurant_Review-g298086-d10060054-Reviews-Quan_Lau_De-Phan_Thiet_Binh_Thuan_Province.html,"385 Nguyen Dinh Chieu Street, Ham Tien Ward, Phan Thiet Vietnam",nan,+84 62 3743 029,nan,#156 of 361 Restaurants in Phan Thiet,nan,4.0,nan,nan,nan,nan,10 reviews,nan,nan,nan,nan,nan,nan,nan,https://dynamic-media-cdn.tripadvisor.com/media/photo-o/15/c0/d1/6d/photo0jpg.jpg?w=900&h=500&s=1
Bình Thuận,Cargo Remote Mui Ne - Restaurant,https://www.tripadvisor.com/Restaurant_Review-g13172842-d19841840-Reviews-Cargo_Remote_Mui_Ne_Restaurant-Ham_Tien_Phan_Thiet_Binh_Thuan_Province.html,"201/88 Nguyen Dinh Chieu Up on the hill from the main street., Ham Tien, Phan Thiet 800000 Vietnam",https://www.facebook.com/cargoremotemuine/,+(84)077 625 2825,cargoremotemuine@gmail.com,#31 of 67 Restaurants in Ham Tien,"Sun: 8:00 AM - 11:00 PM, Mon: 8:00 AM - 11:00 PM, Tue: 8:00 AM - 11:00 PM, Wed: 8:00 AM - 11:00 PM, Thu: 8:00 AM - 11:00 PM, Fri: 8:00 AM - 11:00 PM, Sat: 8:00 AM - 11:00 PM",4.0,nan,nan,nan,nan,6 reviews,"Welcome to Cargo Remote. Dine with us on a lovely hillside with an awesome view or a casual lunch and drinks by the pool. Enjoy craft beer or innovative cocktails at sunset, or enjoy a meal from our sustainably sourced menu. We put great attention to detail when it comes to our food, from the Bo Kho to the Carbonara, our dishes are always made with fresh/quality & locally sourced ingredients.",3.0,10.0,nan,"Breakfast, Lunch, Dinner, Drinks",nan,"Reservations, Outdoor Seating, Seating, Serves Alcohol, Full Bar, Wine and Beer, Free Wifi, Accepts Credit Cards, Table Service, Live Music",https://dynamic-media-cdn.tripadvisor.com/media/photo-o/1a/9b/2a/cf/cheese-burger-local-craft.jpg?w=900&h=500&s=1
