Bình Định,Nhà Hàng Âu Viêt 86,https://www.tripadvisor.com/Restaurant_Review-g608528-d26612517-Reviews-Nha_Hang_Au_Viet_86-Quy_Nhon_Binh_Dinh_Province.html,"86 An Duong Vuong P Nguyen van su, Quy Nhon Vietnam",nan,+84 90 998 05 86,nguyensu1603@gmail.com,nan,"Sun: 10:00 AM - 10:00 PM, Mon: 10:00 AM - 10:00 PM, Tue: 10:00 AM - 10:00 PM, Wed: 10:00 AM - 10:00 PM, Thu: 10:00 AM - 10:00 PM, Fri: 10:00 AM - 10:00 PM, Sat: 10:00 AM - 10:00 PM",nan,nan,nan,nan,nan,nan,Restaurant,nan,nan,nan,"Lunch, Dinner, Brunch, Drinks",nan,"Outdoor Seating, Street Parking, Wheelchair Accessible, Serves Alcohol, Wine and Beer, Cash Only, Free Wifi",nan
Bình Định,Ventosa Coffee & Tea,https://www.tripadvisor.com/Restaurant_Review-g608528-d15009293-Reviews-Ventosa_Coffee_Tea-Quy_Nhon_Binh_Dinh_Province.html,"16 Pham Ngoc Thach, Quy Nhon 590000 Vietnam",http://V-coffee.vn,+84 98 462 09 09,ventosacoffee@gmail.com,nan,"Sun: 6:00 AM - 10:00 PM, Mon: 6:00 AM - 10:00 PM, Tue: 6:00 AM - 10:00 PM, Wed: 6:00 AM - 10:00 PM, Thu: 6:00 AM - 10:00 PM, Fri: 6:00 AM - 10:00 PM, Sat: 6:00 AM - 10:00 PM",nan,nan,nan,nan,nan,nan,"A coffee shop stay at central with 20+ dogs Alaska, Samoyed, Golden, Corgi, Beagle, Husky, Poodle standard, Pug, Basset hound, Cocker Spanish,... 432m2 with private room and public room, have private place for play and take photos with dogs. Food and drinks delicious, special and quite pricey. Service all day from 6am to 10pm. Help travelers all information about Quynhon City, live, apartments, jobs...",0.0,2.0,nan,"Breakfast, Lunch, Dinner",nan,nan,https://dynamic-media-cdn.tripadvisor.com/media/photo-o/15/cd/d2/88/delicious-foods.jpg?w=900&h=500&s=1
Bình Định,Nghia Ghe,https://www.tripadvisor.com/Restaurant_Review-g608528-d10201351-Reviews-Nghia_Ghe-Quy_Nhon_Binh_Dinh_Province.html,"19 Vo Dinh Tu Near Dam Market, Quy Nhon Vietnam",nan,+84 56 3816 093,nan,#78 of 128 Restaurants in Quy Nhon,nan,3.0,nan,nan,nan,nan,1 review,nan,nan,nan,nan,nan,nan,nan,nan
Bình Định,Nhà Hàng Lộc Biển,https://www.tripadvisor.com/Restaurant_Review-g608528-d25575237-Reviews-Nha_Hang_L_c_Bi_n-Quy_Nhon_Binh_Dinh_Province.html,"48 Xuân Diệu, Quy Nhon Vietnam",nan,+84 93 542 33 29,nan,nan,"Sun: 10:00 AM - 11:00 PM, Mon: 10:00 AM - 11:00 PM, Tue: 10:00 AM - 11:00 PM, Wed: 10:00 AM - 11:00 PM, Thu: 10:00 AM - 11:00 PM, Fri: 10:00 AM - 11:00 PM, Sat: 10:00 AM - 11:00 PM",nan,nan,nan,nan,nan,nan,Chuyên hải sản tươi sống Nhà hàng mang phong cách santorini,nan,nan,nan,"Lunch, Dinner",nan,nan,nan
Bình Định,Nhà Hàng Sơn Tùng,https://www.tripadvisor.com/Restaurant_Review-g608528-d25577735-Reviews-Nha_Hang_Son_Tung-Quy_Nhon_Binh_Dinh_Province.html,"Cầu Hà Thanh 4 Đường Quy Nhơn - Nhơn Hội, Quy Nhon 5900000 Vietnam",nan,+84 93 511 13 49,nhstmi93@gmail.com,nan,"Sun: 9:00 AM - 10:00 PM, Mon: 9:00 AM - 10:00 PM, Tue: 9:00 AM - 10:00 PM, Wed: 9:00 AM - 10:00 PM, Thu: 9:00 AM - 10:00 PM, Fri: 9:00 AM - 10:00 PM, Sat: 9:00 AM - 10:00 PM",nan,nan,nan,nan,nan,nan,Nhà hàng nổi Hải sản Tươi sống,nan,nan,nan,"Breakfast, Lunch, Dinner",nan,nan,nan
Bình Định,Hải sản Quy Nhơn -104 Xuân Diệu,https://www.tripadvisor.com/Restaurant_Review-g608528-d26813615-Reviews-H_i_s_n_Quy_Nhon_104_Xuan_Di_u-Quy_Nhon_Binh_Dinh_Province.html,"104 Xuân Diệu, Quy Nhon Vietnam",nan,+84 795 633 367,thutran2604@gmail.com,nan,"Sun: 10:00 AM - 11:00 PM, Mon: 10:00 AM - 11:00 PM, Tue: 10:00 AM - 11:00 PM, Wed: 10:00 AM - 11:00 PM, Thu: 10:00 AM - 11:00 PM, Fri: 10:00 AM - 1:00 AM, Sat: 10:00 AM - 1:00 AM",nan,nan,nan,nan,nan,nan,Nhà hàng chuyên phục vụ về các mặt hàng hải sản. Hải sản ở đây tươi sống mỗi ngày.,nan,nan,nan,"Lunch, Dinner, Brunch, Late Night, Drinks",nan,nan,https://dynamic-media-cdn.tripadvisor.com/media/photo-o/2b/cd/45/a4/caption.jpg?w=900&h=500&s=1
Bình Định,Nhà Hàng BamBoo,https://www.tripadvisor.com/Restaurant_Review-g608528-d23352932-Reviews-Nha_Hang_BamBoo-Quy_Nhon_Binh_Dinh_Province.html,"Thôn Lý Hoà, Quy Nhon 55000 Vietnam",nan,+84 93 465 13 28,bambootre.jsc@gmail.com,nan,nan,nan,nan,nan,nan,nan,nan,"Lấy cảm hứng từ Cây Tre, biểu tượng cho làng quê Việt Nam, cho sự thanh bình và giản dị. Nhà hàng Bamboo được thiết kế theo phong cách gần gũi với thiên nhiên, tạo nên không gian thân thiện nhưng cũng không kém phần đẳng cấp và sang trọng. Với hơn 350 chỗ ngồi, tọa lạc ngay trung tâm Xã Nhơn Lý, TP Quy Nhơn, được đầu tư trang thiết bị phục vụ hiện đại, Bamboo đáp ứng đầy đủ yêu cầu của nhiều thị t",1.0,18.0,nan,nan,nan,nan,nan
Bình Định,Quan Com Dong Que,https://www.tripadvisor.com/Restaurant_Review-g608528-d17783335-Reviews-Quan_Com_Dong_Que-Quy_Nhon_Binh_Dinh_Province.html,"67 Truong Chinh, Quy Nhon 590000 Vietnam",nan,+84 8 5321 6934,nan,nan,"Sun: 5:00 PM - 9:00 PM, Mon: 5:00 PM - 9:00 PM, Tue: 5:00 PM - 9:00 PM, Wed: 5:00 PM - 9:00 PM, Thu: 5:00 PM - 9:00 PM, Fri: 5:00 PM - 9:00 PM, Sat: 5:00 PM - 9:00 PM",nan,nan,nan,nan,nan,nan,nan,nan,nan,nan,"Breakfast, Lunch, Dinner",nan,"Delivery, Takeout, Reservations, Outdoor Seating, Seating, Street Parking, Television, Wine and Beer, Cash Only, Free Wifi, Table Service, Live Music, Waterfront, Jazz Bar, Family style",nan
Bình Định,Hoang Huy,https://www.tripadvisor.com/Restaurant_Review-g608528-d1745777-Reviews-Hoang_Huy-Quy_Nhon_Binh_Dinh_Province.html,"Beach Road, Quy Nhon Vietnam",nan,nan,nan,#80 of 128 Restaurants in Quy Nhon,nan,2.0,nan,nan,nan,nan,1 review,nan,nan,nan,nan,nan,nan,nan,https://dynamic-media-cdn.tripadvisor.com/media/photo-o/04/2f/8a/3b/looks-ok.jpg?w=900&h=500&s=1
Bình Định,Cá Ngừ Đại Dương Chị Thuận Quy Nhơn,https://www.tripadvisor.com/Restaurant_Review-g608528-d24134852-Reviews-Ca_Ng_D_i_Duong_Ch_Thu_n_Quy_Nhon-Quy_Nhon_Binh_Dinh_Province.html,"Lô Dc5, 15 Bùi Hữu Nghĩa, Quy Nhon Vietnam",nan,+84 90 544 70 81,nan,nan,"Sun: 10:00 AM - 10:00 PM, Mon: 10:00 AM - 10:00 PM, Tue: 10:00 AM - 10:00 PM, Wed: 10:00 AM - 10:00 PM, Thu: 10:00 AM - 10:00 PM, Fri: 10:00 AM - 10:00 PM, Sat: 10:00 AM - 10:00 PM",nan,nan,nan,nan,nan,nan,nan,nan,nan,nan,"Lunch, Dinner",nan,nan,nan
Bình Định,Mon Go Restaurant,https://www.tripadvisor.com/Restaurant_Review-g608528-d25383042-Reviews-Mon_Go_Restaurant-Quy_Nhon_Binh_Dinh_Province.html,"158 Xuân Diệu, Quy Nhon Vietnam",nan,nan,nan,nan,"Sun: 10:00 AM - 12:00 AM, Mon: 10:00 AM - 12:00 AM, Tue: 10:00 AM - 12:00 AM, Wed: 10:00 AM - 12:00 AM, Thu: 10:00 AM - 12:00 AM, Fri: 10:00 AM - 12:00 AM, Sat: 10:00 AM - 12:00 AM",nan,nan,nan,nan,nan,nan,nan,nan,nan,nan,"Lunch, Dinner, Late Night, Drinks",nan,nan,nan
Bình Định,Bep Nha Xu Nau,https://www.tripadvisor.com/Restaurant_Review-g608528-d20379112-Reviews-Bep_Nha_Xu_Nau-Quy_Nhon_Binh_Dinh_Province.html,"68 Nam Cao, Ghenh Rang, Quy Nhon 591300 Vietnam",nan,+(84)9095609008,bepnhaxunau.ghenhrang.quynhon@gmail.com,nan,nan,nan,nan,nan,nan,nan,nan,nan,0.0,20.0,nan,nan,nan,nan,nan
Bình Định,Lebon Restaurant,https://www.tripadvisor.com/Restaurant_Review-g608528-d25243337-Reviews-Lebon_Restaurant-Quy_Nhon_Binh_Dinh_Province.html,"1H1 Nguyễn Thị Định, Nguyễn Văn Cừ Góc Trần Văn Ơn và Nguyễn Thị Định, Quy Nhon 55000 Vietnam",nan,+84 256 2226 868,sales@lamorboutiquehotel.com,nan,"Sun: 11:00 AM - 10:00 PM, Mon: 11:00 AM - 10:00 PM, Tue: 11:00 AM - 10:00 PM, Wed: 11:00 AM - 10:00 PM, Thu: 11:00 AM - 10:00 PM, Fri: 11:00 AM - 10:00 PM, Sat: 11:00 AM - 10:00 PM",nan,nan,nan,nan,nan,nan,"Nhà hàng ẩm thực fusion , pha trộn các món ăn khác nhau giữa các nền ẩm thực Âu, Á",nan,nan,nan,"Lunch, Dinner",nan,nan,nan
Bình Định,Banh Hoi Chao Long Hong Thanh,https://www.tripadvisor.com/Restaurant_Review-g608528-d14112130-Reviews-Banh_Hoi_Chao_Long_Hong_Thanh-Quy_Nhon_Binh_Dinh_Province.html,"22 Phan Boi Chau, Quy Nhon 590000 Vietnam",https://www.facebook.com/banhhoiHongThanh/,+84 168 493 8370,banhhoihongthanh@gmail.com,nan,nan,nan,nan,nan,nan,nan,nan,"This is a small local restaurant serving one of the famous specialty of Quy Nhon ""Banh hoi chao long"". Main ingredients are pig's tripes and fine rice vermicelli, very delicious. Price is very reasonable, 25.000vnd ~ 1.1$. It is worth to try if it is your first time to Quy Nhon, Vietnam. Opening hour: from 6AM to 10'30AM. It is suitable for family guest, tourist groups...",0.0,2.0,nan,nan,nan,nan,https://dynamic-media-cdn.tripadvisor.com/media/photo-o/13/05/ef/2f/getlstd-property-photo.jpg?w=900&h=500&s=1
Bình Định,Sushi Haru - Quy Nhơn,https://www.tripadvisor.com/Restaurant_Review-g608528-d21138080-Reviews-Sushi_Haru_Quy_Nhon-Quy_Nhon_Binh_Dinh_Province.html,"150 Ỷ Lan, Quy Nhon Vietnam",nan,+84 90 192 34 68,nan,nan,nan,nan,nan,nan,nan,nan,nan,nan,nan,nan,nan,nan,nan,nan,nan
Bình Định,For Teen - Lau & Nuong,https://www.tripadvisor.com/Restaurant_Review-g608528-d15871296-Reviews-For_Teen_Lau_Nuong-Quy_Nhon_Binh_Dinh_Province.html,"45 Hoang Dieu, Quy Nhon 590000 Vietnam",nan,+84 90 595 79 67,nan,#81 of 128 Restaurants in Quy Nhon,nan,2.0,nan,nan,nan,nan,1 review,nan,nan,nan,nan,nan,nan,nan,nan
Bình Định,Saigon Bistro,https://www.tripadvisor.com/Restaurant_Review-g608528-d18927815-Reviews-Saigon_Bistro-Quy_Nhon_Binh_Dinh_Province.html,"Nguyen Trung Tin, Quy Nhon Vietnam",nan,+84 91 495 91 91,nan,nan,nan,nan,nan,nan,nan,nan,nan,nan,nan,nan,nan,nan,nan,nan,nan
Bình Định,Life Is A Beach,https://www.tripadvisor.com/Restaurant_Review-g608528-d28040509-Reviews-Life_Is_A_Beach-Quy_Nhon_Binh_Dinh_Province.html,"Beach Near Avani Resort Quy Nhon, Quy Nhon Vietnam",nan,nan,nan,nan,"Sun: 5:00 AM - 2:00 AM, Mon: 5:00 AM - 2:00 AM, Tue: 5:00 AM - 2:00 AM, Wed: 5:00 AM - 2:00 AM, Thu: 5:00 AM - 2:00 AM, Fri: 5:00 AM - 2:00 AM, Sat: 5:00 AM - 2:00 AM",nan,nan,nan,nan,nan,nan,nan,nan,nan,nan,"Breakfast, Lunch, Dinner",nan,nan,nan
Bình Định,Am Thuc Dau,https://www.tripadvisor.com/Restaurant_Review-g608528-d21126047-Reviews-Am_Thuc_Dau-Quy_Nhon_Binh_Dinh_Province.html,"24 Nguyen Lu, Quy Nhon 55000 Vietnam",https://www.facebook.com/amthucdau/,+84 33 337 0011,lamdq@amthucdau.vn,nan,nan,nan,nan,nan,nan,nan,nan,"Bean Cuisine serves traditional Vietnamese dishes such as: Congee porridge, Porridge with rice, Rice noodles with shrimp sauce, Rieu hotpot, ...",1.0,4.0,nan,nan,nan,nan,https://dynamic-media-cdn.tripadvisor.com/media/photo-o/1b/8c/8d/10/getlstd-property-photo.jpg?w=900&h=500&s=1
Bình Định,Nha Hang Fulok - Champa,https://www.tripadvisor.com/Restaurant_Review-g608528-d14135907-Reviews-Nha_Hang_Fulok_Champa-Quy_Nhon_Binh_Dinh_Province.html,"50/1 An Duong Vuong, Quy Nhon 590000 Vietnam",https://www.facebook.com/nhahangfulok/,+84 93 474 45 66,nan,nan,nan,nan,nan,nan,nan,nan,nan,nan,1.0,16.0,nan,nan,nan,nan,https://dynamic-media-cdn.tripadvisor.com/media/photo-o/13/1a/05/b2/getlstd-property-photo.jpg?w=900&h=500&s=1
Bình Định,Nha Hang Du Lich Hon Kho,https://www.tripadvisor.com/Restaurant_Review-g608528-d17415328-Reviews-Nha_Hang_Du_Lich_Hon_Kho-Quy_Nhon_Binh_Dinh_Province.html,"Hai Bac Hamlet, Nhon Hai Commune, Quy Nhon 590000 Vietnam",nan,0256 844 567,nhahangdulichhonkho@gmail.com,nan,nan,nan,nan,nan,nan,nan,nan,nan,nan,nan,nan,nan,nan,nan,nan
Bình Định,Bep Nha Xu Nau,https://www.tripadvisor.com/Restaurant_Review-g608528-d20381807-Reviews-Bep_Nha_Xu_Nau-Quy_Nhon_Binh_Dinh_Province.html,"68 Nam Cao Ghenh Rang, Quy Nhon Vietnam",nan,+84 90 560 90 08,nan,nan,nan,nan,nan,nan,nan,nan,nan,nan,nan,nan,nan,nan,nan,nan,nan
Bình Định,Quand Oc Hao,https://www.tripadvisor.com/Restaurant_Review-g608528-d25260973-Reviews-Quand_Oc_Hao-Quy_Nhon_Binh_Dinh_Province.html,"248 Xiang Dieu, Quy Nhon Vietnam",nan,+84 388 938 525,nan,nan,nan,nan,nan,nan,nan,nan,nan,nan,nan,nan,nan,nan,nan,nan,nan
Bình Định,Luna Coffee,https://www.tripadvisor.com/Restaurant_Review-g608528-d12918416-Reviews-Luna_Coffee-Quy_Nhon_Binh_Dinh_Province.html,"263/7 Hoang Van Thu, Quy Nhon 820000 Vietnam",nan,+84 93 452 71 02,nan,nan,nan,nan,nan,nan,nan,nan,nan,"Luna Coffee Is Cozy Cafe/Bar complete with a pool table, which serves great coffee, cocktails, beer, and a range of Vietnamese and European food.",0.0,2.0,nan,nan,nan,nan,nan
Bình Định,Nha hang Container,https://www.tripadvisor.com/Restaurant_Review-g608528-d12610247-Reviews-Nha_hang_Container-Quy_Nhon_Binh_Dinh_Province.html,"01A Tran Thi Ky, Quy Nhon Vietnam",nan,+84 91 490 75 55,nan,nan,nan,nan,nan,nan,nan,nan,nan,nan,nan,nan,nan,nan,nan,nan,nan
Bình Định,Quán Bún Cá Quê Hương,https://www.tripadvisor.com/Restaurant_Review-g608528-d23320012-Reviews-Quan_Bun_Ca_Que_Huong-Quy_Nhon_Binh_Dinh_Province.html,"136 Đường Nguyễn Huệ Trần Phú, Quy Nhon Vietnam",nan,nan,nan,nan,nan,nan,nan,nan,nan,nan,nan,nan,nan,nan,nan,nan,nan,nan,nan
Bình Định,Bun Bo Hem,https://www.tripadvisor.com/Restaurant_Review-g608528-d17414635-Reviews-Bun_Bo_Hem-Quy_Nhon_Binh_Dinh_Province.html,"158 Dien Hong, Quy Nhon 590000 Vietnam",nan,+84 122 414 8925,nan,nan,nan,nan,nan,nan,nan,nan,nan,nan,nan,nan,nan,nan,nan,nan,nan
Bình Định,Nem cha nuong cuon • Bun kho thit nuong • Hoa,https://www.tripadvisor.com/Restaurant_Review-g608528-d21041465-Reviews-Nem_cha_nuong_cuon_Bun_kho_thit_nuong_Hoa-Quy_Nhon_Binh_Dinh_Province.html,Quy Nhon Vietnam,nan,+84 98 880 88 41,nan,nan,nan,nan,nan,nan,nan,nan,nan,nan,nan,nan,nan,nan,nan,nan,nan
Bình Định,Tịnh tour Hải Sản Sống,https://www.tripadvisor.com/Restaurant_Review-g608528-d24015109-Reviews-Ti_nh_tour_Ha_i_Sa_n_So_ng-Quy_Nhon_Binh_Dinh_Province.html,"Thôn Lý Lương, Quy Nhon Vietnam",nan,+84 366 895 954,vinh01243@gmail.com,nan,"Sun: 12:00 AM - 11:59 PM, Mon: 12:00 AM - 11:59 PM, Tue: 12:00 AM - 11:59 PM, Wed: 12:00 AM - 11:59 PM, Thu: 12:00 AM - 11:59 PM, Fri: 12:00 AM - 11:59 PM, Sat: 12:00 AM - 11:59 PM",nan,nan,nan,nan,nan,nan,nan,nan,nan,nan,"Breakfast, Lunch, Dinner",nan,nan,nan
Bình Định,Bonjour Bistro,https://www.tripadvisor.com/Restaurant_Review-g14557698-d19882077-Reviews-Bonjour_Bistro-Hoai_Nhon_Binh_Dinh_Province.html,"74 Tran Phu Bong Son, Hoai Nhon Vietnam",nan,+84 93 481 64 63,nan,#1 of 1 Restaurant in Hoai Nhon,nan,nan,nan,nan,nan,nan,nan,nan,1.0,5.0,nan,nan,nan,nan,nan
Bình Định,Banh Xeo Tom Nhay Rau Mam,https://www.tripadvisor.com/Restaurant_Review-g608528-d20297818-Reviews-Banh_Xeo_Tom_Nhay_Rau_Mam-Quy_Nhon_Binh_Dinh_Province.html,"91 Dong Đa Thi Nai, Quy Nhon Vietnam",nan,+84 256 3823 258,nan,nan,nan,nan,nan,nan,nan,nan,nan,nan,nan,nan,nan,nan,nan,nan,nan
Bình Định,Bún Đậu Hoa Phượng Đỏ,https://www.tripadvisor.com/Restaurant_Review-g608528-d28005546-Reviews-Bun_D_u_Hoa_Phu_ng_D-Quy_Nhon_Binh_Dinh_Province.html,"25 Lê Hồng Phong, Quy Nhon 55106 Vietnam",nan,nan,nan,nan,nan,nan,nan,nan,nan,nan,nan,nan,nan,nan,nan,nan,nan,nan,nan
Bình Định,Fuji Sushi,https://www.tripadvisor.com/Restaurant_Review-g608528-d19595458-Reviews-Fuji_Sushi-Quy_Nhon_Binh_Dinh_Province.html,"51 Le Hong Phong, Quy Nhon 590000 Vietnam",nan,+84 93 262 50 53,nan,nan,nan,nan,nan,nan,nan,nan,nan,nan,nan,nan,nan,nan,nan,nan,nan
Bình Định,Nhà Hàng Sinh Thái An Nam - Gà Tộc Cơm Lam,https://www.tripadvisor.com/Restaurant_Review-g608528-d27662635-Reviews-Nha_Hang_Sinh_Thai_An_Nam_Ga_T_c_Com_Lam-Quy_Nhon_Binh_Dinh_Province.html,"Quốc Lộ 1d, Quy Nhon 55000 Vietnam",nan,+84 70 5112 379,tapdoanhappyworld@gmail.com,nan,nan,nan,nan,nan,nan,nan,nan,nan,nan,nan,nan,nan,nan,nan,nan
Bình Định,Bun Khai,https://www.tripadvisor.com/Restaurant_Review-g608528-d7370501-Reviews-Bun_Khai-Quy_Nhon_Binh_Dinh_Province.html,"148 Phan Boi Chau, Quy Nhon Vietnam",nan,+84 98 335 41 68,nan,nan,nan,nan,nan,nan,nan,nan,nan,nan,nan,nan,nan,nan,nan,nan,nan
Bình Dương,Oryzaa Restaurant,https://www.tripadvisor.com/Restaurant_Review-g11981259-d23488850-Reviews-Oryzaa_Restaurant-Thuan_An_Binh_Duong_Province.html,"No. 5 Huu Nghi Avenue, Vietnam-Singapore Industrial Park , Binh Hoa Ward Fairfield by Marriott South Binh Duong, Thuan An 820000 Vietnam",nan,+84 274 3787 300,nan,#1 of 23 Restaurants in Thuan An,"Sun: 6:30 AM - 10:00 PM, Mon: 6:30 AM - 10:00 PM, Tue: 6:30 AM - 10:00 PM, Wed: 6:30 AM - 10:00 PM, Thu: 6:30 AM - 10:00 PM, Fri: 6:30 AM - 10:00 PM, Sat: 6:30 AM - 10:00 PM",5.0,4.8,5.0,5.0,nan,23 reviews,"ORYZAA - AN ATTRACTIVE CULINARY RENDEZVOUS If you are looking for the unique flavour of Binh Duong and an excellent culinary experience in this up and coming city, ORYZAA is a must-visit destination where you can indulge in an array of wonderfully delicious dishes.",nan,nan,nan,"Breakfast, Lunch, Dinner",nan,"Reservations, Outdoor Seating, Buffet, Seating, Accepts Credit Cards, Table Service",https://dynamic-media-cdn.tripadvisor.com/media/photo-o/1d/40/2c/ab/oryzaa.jpg?w=900&h=500&s=1
Bình Dương,King's Grill,https://www.tripadvisor.com/Restaurant_Review-g3311194-d27929294-Reviews-King_s_Grill-Thu_Dau_Mot_Binh_Duong_Province.html,"34 Đường Hoàng Văn Thụ, Thu Dau Mot Vietnam",nan,+84 33 666 7301,kingsgrill34bd@gmail.com,#1 of 63 Restaurants in Thu Dau Mot,"Sun: 4:00 PM - 11:30 PM, Mon: 4:00 PM - 11:30 PM, Tue: 4:00 PM - 11:30 PM, Wed: 4:00 PM - 11:30 PM, Thu: 4:00 PM - 11:30 PM, Fri: 4:00 PM - 11:30 PM, Sat: 4:00 PM - 11:30 PM",5.0,5.0,5.0,5.0,5.0,11 reviews,nan,nan,nan,nan,Dinner,nan,Reservations,https://dynamic-media-cdn.tripadvisor.com/media/photo-o/2c/8a/d8/18/nha-hang-chau-a-menu.jpg?w=900&h=500&s=1
Bình Dương,The Sushi Bar 7,https://www.tripadvisor.com/Restaurant_Review-g3311194-d11953821-Reviews-The_Sushi_Bar_7-Thu_Dau_Mot_Binh_Duong_Province.html,"Hikari Ly Thai To St Back-Gate of Binh Duong New City Hall, Thu Dau Mot Vietnam",http://sushibar-vn.com/location/,+84 650 3801 122,nan,#4 of 63 Restaurants in Thu Dau Mot,nan,4.5,4.4,4.4,4.2,nan,12 reviews,nan,nan,nan,nan,"Lunch, Dinner, Brunch, Drinks",nan,nan,https://dynamic-media-cdn.tripadvisor.com/media/photo-o/1a/c1/da/76/interior.jpg?w=900&h=500&s=1
Bình Dương,MION Modern Thai,https://www.tripadvisor.com/Restaurant_Review-g3311194-d25614750-Reviews-MION_Modern_Thai-Thu_Dau_Mot_Binh_Duong_Province.html,"57 Tran Van On, Thu Dau Mot Vietnam",https://www.facebook.com/mionmodernthai,+84 70 7600 216,nan,#2 of 63 Restaurants in Thu Dau Mot,"Sun: 4:00 PM - 10:00 PM, Mon: 4:00 PM - 10:00 PM, Tue: 4:00 PM - 10:00 PM, Wed: 4:00 PM - 10:00 PM, Thu: 4:00 PM - 10:00 PM, Fri: 4:00 PM - 10:00 PM, Sat: 4:00 PM - 10:00 PM",5.0,nan,nan,nan,nan,7 reviews,"If you love Thai food, this Mion Modern Thai restaurant will not disappoint you.",nan,nan,nan,"Dinner, Drinks",nan,"Outdoor Seating, Parking Available, Highchairs Available, Full Bar, Wine and Beer, Free Wifi, Accepts Credit Cards",https://dynamic-media-cdn.tripadvisor.com/media/photo-o/29/9c/ed/7a/caption.jpg?w=900&h=500&s=1
Bình Dương,Akataiyo,https://www.tripadvisor.com/Restaurant_Review-g3311194-d13163038-Reviews-Akataiyo-Thu_Dau_Mot_Binh_Duong_Province.html,"134/2 Duong 30/4 Phu Hoa Ward, Thu Dau Mot 590000 Vietnam",nan,+84 90 679 19 38,info@akataiyo.vn,#7 of 63 Restaurants in Thu Dau Mot,"Sun: 10:00 AM - 2:00 PM5:00 PM - 11:00 PM, Mon: 10:00 AM - 2:00 PM5:00 PM - 11:00 PM, Tue: 10:00 AM - 2:00 PM5:00 PM - 11:00 PM, Wed: 10:00 AM - 2:00 PM5:00 PM - 11:00 PM, Thu: 10:00 AM - 2:00 PM5:00 PM - 11:00 PM, Fri: 10:00 AM - 2:00 PM5:00 PM - 11:00 PM, Sat: 10:00 AM - 2:00 PM5:00 PM - 11:00 PM",4.5,nan,nan,nan,nan,10 reviews,Akataiyo Binh Duong Restaurant is a new branch of Akataiyo Restaurant in Vietnam. The restaurant specializes in Japanese cuisine at affordable prices. Bring you the satisfaction and quality according to Japanese standard.,4.0,40.0,nan,"Lunch, Dinner",nan,"Accepts Credit Cards, Table Service",https://dynamic-media-cdn.tripadvisor.com/media/photo-o/11/4b/d3/bc/getlstd-property-photo.jpg?w=900&h=500&s=1
Bình Dương,Hideout - Kitchen & Bar,https://www.tripadvisor.com/Restaurant_Review-g3311194-d25467780-Reviews-Hideout_Kitchen_Bar-Thu_Dau_Mot_Binh_Duong_Province.html,"272/113 Đường D, Phường Chánh Nghĩa, Thu Dau Mot 75000 Vietnam",nan,+84 783 537 939,nan,#10 of 63 Restaurants in Thu Dau Mot,"Sun: 4:00 PM - 11:00 PM, Mon: 4:00 PM - 11:00 PM, Tue: 4:00 PM - 11:00 PM, Wed: 4:00 PM - 11:00 PM, Thu: 4:00 PM - 11:00 PM, Fri: 4:00 PM - 11:00 PM, Sat: 4:00 PM - 11:00 PM",5.0,nan,nan,nan,nan,3 reviews,"A Viet - America Fusion Restaurant. Our signature dishes are Charcoal Grilled BBQ Porkribs and Chicken Wings. Bar serve Craft Beer out of tap and Highball / Cocktails, and also wine.",1.0,40.0,nan,"Dinner, Late Night, Drinks",nan,"Delivery, Takeout, Reservations, Outdoor Seating, Parking Available, Free off-street parking, Highchairs Available, Wine and Beer, Accepts American Express, Accepts Mastercard, Accepts Visa, Digital Payments, Free Wifi, Accepts Credit Cards, Dog Friendly, Family style",https://dynamic-media-cdn.tripadvisor.com/media/photo-o/29/e7/ed/55/dining-area.jpg?w=900&h=500&s=1
Bình Dương,Quan Ong Tay,https://www.tripadvisor.com/Restaurant_Review-g3311194-d14789536-Reviews-Quan_Ong_Tay-Thu_Dau_Mot_Binh_Duong_Province.html,"Hoang Van Thu Chanh Nghia, Thu Dau Mot 820000 Vietnam",nan,+84 96 301 11 13,nan,#9 of 63 Restaurants in Thu Dau Mot,"Sun: 11:30 AM - 10:00 PM, Mon: 11:30 AM - 10:00 PM, Tue: 11:30 AM - 10:00 PM, Wed: 11:30 AM - 10:00 PM, Thu: 11:30 AM - 10:00 PM, Fri: 11:30 AM - 10:00 PM, Sat: 11:30 AM - 10:00 PM",4.0,nan,nan,nan,nan,12 reviews,nan,nan,nan,nan,"Lunch, Dinner",nan,"Reservations, Table Service",https://dynamic-media-cdn.tripadvisor.com/media/photo-o/1d/11/f8/64/photo1jpg.jpg?w=900&h=500&s=1
Bình Dương,An Tuong Cafe,https://www.tripadvisor.com/Restaurant_Review-g3311194-d7753779-Reviews-An_Tuong_Cafe-Thu_Dau_Mot_Binh_Duong_Province.html,"43 Thich Quang Duc Phu Hoa, Thu Dau Mot Vietnam",nan,+84 274 3842 379,nan,#3 of 63 Restaurants in Thu Dau Mot,nan,4.5,4.3,4.4,4.4,nan,24 reviews,nan,nan,nan,nan,"Breakfast, Lunch, Dinner",Vegetarian friendly,"Reservations, Outdoor Seating, Seating, Table Service",https://dynamic-media-cdn.tripadvisor.com/media/photo-o/0e/f9/59/38/garden-5.jpg?w=900&h=500&s=1
Bình Dương,Cua Ngon Binh Duong,https://www.tripadvisor.com/Restaurant_Review-g3311194-d19728550-Reviews-Cua_Ngon_Binh_Duong-Thu_Dau_Mot_Binh_Duong_Province.html,"26-27 Hoang Van Thu Chanh Nghia Residences Area, Thu Dau Mot 820000 Vietnam",http://cuacamau.com/,+84 91 858 96 66,info@cuacamau.com,#18 of 63 Restaurants in Thu Dau Mot,"Sun: 9:00 AM - 11:00 PM, Mon: 9:00 AM - 11:00 PM, Tue: 9:00 AM - 11:00 PM, Wed: 9:00 AM - 11:00 PM, Thu: 9:00 AM - 11:00 PM, Fri: 9:00 AM - 11:00 PM, Sat: 9:00 AM - 11:00 PM",5.0,nan,nan,nan,nan,2 reviews,"A place to enjoy delicious dishes from Ca Mau Sea Crab of Cua Ngon Brand - Huong Dat Mui which has been trusted by customers from near and far. It is a sales station of Cua Ngon Company with the sale of Cua Ca Mau products - delivered to customers in Binh Duong, Dong Nai. Come to Cua Ngon Binh Duong, customers will enjoy special delicacies from the original Ca Mau Crab specialties. in a cozy",0.0,1.0,nan,"Breakfast, Lunch, Dinner, Drinks",nan,"Delivery, Reservations, Outdoor Seating, Seating, Parking Available, Street Parking, Valet Parking, Free off-street parking, Television, Highchairs Available, Wine and Beer, Digital Payments, Free Wifi, Accepts Credit Cards, Table Service, Family style",https://dynamic-media-cdn.tripadvisor.com/media/photo-o/1b/aa/f5/e4/day-la-b-n-be-minh-ne.jpg?w=900&h=500&s=1
Bình Dương,Marukame Udon,https://www.tripadvisor.com/Restaurant_Review-g11981259-d6437478-Reviews-Marukame_Udon-Thuan_An_Binh_Duong_Province.html,"01 Binh Duong Avenue 2nd Floor, Aeon Mall Canary Binh Duong, Binh Giao, Thuan Giao, Thuan An 820000 Vietnam",http://www.marukameudon.vn,+84 650 3763 442,mrk-binhduong@toridollvlotus.vn,#2 of 23 Restaurants in Thuan An,"Sun: 10:00 AM - 10:00 PM, Mon: 10:00 AM - 10:00 PM, Tue: 10:00 AM - 10:00 PM, Wed: 10:00 AM - 10:00 PM, Thu: 10:00 AM - 10:00 PM, Fri: 10:00 AM - 10:00 PM, Sat: 10:00 AM - 10:00 PM",4.0,nan,nan,nan,nan,153 reviews,nan,nan,nan,nan,"Lunch, Dinner, Brunch",Vegetarian friendly,"Takeout, Seating",https://dynamic-media-cdn.tripadvisor.com/media/photo-o/0d/4f/db/25/caption.jpg?w=900&h=-1&s=1
Bình Dương,Juugoya Geihinkan,https://www.tripadvisor.com/Restaurant_Review-g3311194-d5828083-Reviews-Juugoya_Geihinkan-Thu_Dau_Mot_Binh_Duong_Province.html,"Kim Dong Road, Thu Dau Mot Vietnam",nan,+84 650 2220 950,juugoya@fullmoon.com.vn,#11 of 63 Restaurants in Thu Dau Mot,"Sun: 11:00 AM - 10:00 PM, Mon: 11:00 AM - 10:00 PM, Tue: 11:00 AM - 10:00 PM, Wed: 11:00 AM - 10:00 PM, Thu: 11:00 AM - 10:00 PM, Fri: 11:00 AM - 10:00 PM, Sat: 11:00 AM - 10:00 PM",4.5,4.4,4.6,4.0,nan,11 reviews,"JUUGOYA GEIHINKAN is an authentic Japanese restaurant located by a beautiful lake in Binh Duong New City. Surrounded in a traditional Japanese atmosphere, feast yourself on real Japanese dishes created by professional Japanese chefs.",20.0,50.0,nan,"Lunch, Dinner",nan,nan,https://dynamic-media-cdn.tripadvisor.com/media/photo-o/05/a5/b8/77/juugoya-geihinkan.jpg?w=900&h=-1&s=1
Bình Dương,Al Fresco's Binh Duong,https://www.tripadvisor.com/Restaurant_Review-g3311194-d10697813-Reviews-Al_Fresco_s_Binh_Duong-Thu_Dau_Mot_Binh_Duong_Province.html,"Boulevard Binh Duong, Highway 13 G-26c Ground floor AEON MALL Binh Duong Canary, Thu Dau Mot Vietnam",nan,+84 650 3763 481,nan,#5 of 63 Restaurants in Thu Dau Mot,nan,4.5,nan,nan,nan,nan,12 reviews,nan,nan,nan,nan,nan,nan,Reservations,https://dynamic-media-cdn.tripadvisor.com/media/photo-o/1a/49/b1/9f/quan-d-p-khong-gian-thoang.jpg?w=900&h=500&s=1
